{
  "schema_version": "0.2",
  "enabled": false,
  "transport": "unselected",
  "allow_unofficial_transport": false,
  "allowed_room_ids": [],
  "reply_mode": "draft_only",
  "publish_send_tool": false,
  "mention_required": true,
  "allow_prefix_trigger": false,
  "ignore_self": true,
  "ignore_known_bots": true,
  "collect_only_triggered_messages": true,
  "context_max_messages": 20,
  "context_max_age_seconds": 600,
  "context_max_chars": 8000,
  "reply_max_chars": 800,
  "room_max_replies_per_minute": 3,
  "global_max_replies_per_minute": 10,
  "room_max_inflight": 1,
  "message_ttl_seconds": 300,
  "draft_ttl_seconds": 900,
  "notice_confirmed": false,
  "raw_message_log": false,
  "gateway_content_retention_hours": 24,
  "cross_room_memory": false,
  "external_action_tools": false,
  "text_only": true,
  "auth_required": true,
  "owner_approval_required": true
}
